{
  "id": "clickup",
  "name": "ClickUp",
  "description": "Tasks, docs, goals, and workflow automation.",
  "categories": [
    "Project management",
    "Operations"
  ],
  "appUrl": "https://clickup.com",
  "docsUrl": "https://clickup.com/api/developer-portal/authentication",
  "notes": "Large install base and broad operations coverage.",
  "popularityRank": 15,
  "connectionOptions": [
    {
      "id": "oauth",
      "provider": "mcp",
      "auth": {
        "strategy": "oauth2",
        "oauth": {
          "authorizationUrl": "https://app.clickup.com/api",
          "tokenUrl": "https://api.clickup.com/api/v2/oauth/token",
          "scopes": []
        }
      },
      "transport": {
        "kind": "shttp",
        "url": "https://mcp.clickup.com/mcp"
      }
    }
  ]
}
