{
  "id": "bitbucket",
  "name": "Bitbucket",
  "description": "Repositories, pull requests, and Atlassian engineering workflows.",
  "categories": [
    "Engineering",
    "Source control"
  ],
  "appUrl": "https://bitbucket.org",
  "docsUrl": "https://developer.atlassian.com/cloud/bitbucket/oauth-2/",
  "notes": "Bitbucket Cloud is reached through Atlassian's hosted Rovo MCP server (Atlassian MCP v2), the same connection as Jira and Confluence: sign in with your Atlassian account when the authentication flow starts. The REST option is for OAuth apps against the Bitbucket API.",
  "popularityRank": 50,
  "connectionOptions": [
    {
      "id": "mcp",
      "provider": "mcp",
      "transport": {
        "kind": "shttp",
        "url": "https://mcp.atlassian.com/v2/mcp"
      },
      "auth": {
        "strategy": "oauth2",
        "oauth": {
          "clientAuthentication": "none"
        }
      }
    },
    {
      "id": "oauth",
      "provider": "http",
      "auth": {
        "strategy": "oauth2",
        "oauth": {
          "authorizationUrl": "https://bitbucket.org/site/oauth2/authorize",
          "tokenUrl": "https://bitbucket.org/site/oauth2/access_token",
          "scopes": [
            "account",
            "repository"
          ]
        }
      },
      "http": {
        "apiBaseUrl": "https://api.bitbucket.org/2.0",
        "openApiUrl": "https://developer.atlassian.com/cloud/bitbucket/swagger.v3.json"
      }
    }
  ]
}
